{"timestamp":"2026-03-30T14:38:53.80744742Z","iteration":0,"channel":0,"commit":"e28806a","metric_name":"post_quality","metric_value":8.05,"best_metric":8.05,"status":"keep","duration_seconds":144.167251119,"description":"baseline","patch_summary":"","worktree":"","error":""}
{"timestamp":"2026-03-30T14:38:53.815358535Z","iteration":1,"channel":1,"commit":"","metric_name":"post_quality","metric_value":0,"best_metric":8.05,"status":"crash","duration_seconds":0,"description":"","patch_summary":"","worktree":"","error":""}
{"timestamp":"2026-03-30T14:38:53.818191182Z","iteration":1,"channel":2,"commit":"","metric_name":"post_quality","metric_value":0,"best_metric":8.05,"status":"crash","duration_seconds":0,"description":"","patch_summary":"","worktree":"","error":""}
{"timestamp":"2026-03-30T14:38:53.820980199Z","iteration":1,"channel":0,"commit":"","metric_name":"post_quality","metric_value":0,"best_metric":8.05,"status":"crash","duration_seconds":0,"description":"","patch_summary":"","worktree":"","error":""}
{"timestamp":"2026-03-30T14:38:53.824986916Z","iteration":1,"channel":4,"commit":"","metric_name":"post_quality","metric_value":0,"best_metric":8.05,"status":"crash","duration_seconds":0,"description":"","patch_summary":"","worktree":"","error":""}
{"timestamp":"2026-03-30T14:38:53.828567567Z","iteration":1,"channel":3,"commit":"","metric_name":"post_quality","metric_value":0,"best_metric":8.05,"status":"crash","duration_seconds":0,"description":"","patch_summary":"","worktree":"","error":""}
{"timestamp":"2026-03-30T14:42:00.426014849Z","iteration":0,"channel":0,"commit":"2e039d6","metric_name":"post_quality","metric_value":8,"best_metric":8,"status":"keep","duration_seconds":165.309652085,"description":"baseline","patch_summary":"","worktree":"","error":""}
{"timestamp":"2026-03-30T14:42:00.433620326Z","iteration":1,"channel":2,"commit":"","metric_name":"post_quality","metric_value":0,"best_metric":8,"status":"crash","duration_seconds":0,"description":"","patch_summary":"","worktree":"","error":""}
{"timestamp":"2026-03-30T14:42:00.435962187Z","iteration":1,"channel":0,"commit":"","metric_name":"post_quality","metric_value":0,"best_metric":8,"status":"crash","duration_seconds":0,"description":"","patch_summary":"","worktree":"","error":""}
{"timestamp":"2026-03-30T14:42:00.438636345Z","iteration":1,"channel":1,"commit":"","metric_name":"post_quality","metric_value":0,"best_metric":8,"status":"crash","duration_seconds":0,"description":"","patch_summary":"","worktree":"","error":""}
{"timestamp":"2026-03-30T14:42:00.441351542Z","iteration":1,"channel":4,"commit":"","metric_name":"post_quality","metric_value":0,"best_metric":8,"status":"crash","duration_seconds":0,"description":"","patch_summary":"","worktree":"","error":""}
{"timestamp":"2026-03-30T14:42:00.44405831Z","iteration":1,"channel":3,"commit":"","metric_name":"post_quality","metric_value":0,"best_metric":8,"status":"crash","duration_seconds":0,"description":"","patch_summary":"","worktree":"","error":""}
{"timestamp":"2026-03-30T14:42:00.452682079Z","iteration":2,"channel":3,"commit":"","metric_name":"post_quality","metric_value":0,"best_metric":8,"status":"crash","duration_seconds":0,"description":"","patch_summary":"","worktree":"","error":""}
{"timestamp":"2026-03-30T14:42:00.455338787Z","iteration":2,"channel":4,"commit":"","metric_name":"post_quality","metric_value":0,"best_metric":8,"status":"crash","duration_seconds":0,"description":"","patch_summary":"","worktree":"","error":""}
{"timestamp":"2026-03-30T14:42:00.458033005Z","iteration":2,"channel":1,"commit":"","metric_name":"post_quality","metric_value":0,"best_metric":8,"status":"crash","duration_seconds":0,"description":"","patch_summary":"","worktree":"","error":""}
{"timestamp":"2026-03-30T14:42:00.460741012Z","iteration":2,"channel":0,"commit":"","metric_name":"post_quality","metric_value":0,"best_metric":8,"status":"crash","duration_seconds":0,"description":"","patch_summary":"","worktree":"","error":""}
{"timestamp":"2026-03-30T14:42:00.463355501Z","iteration":2,"channel":2,"commit":"","metric_name":"post_quality","metric_value":0,"best_metric":8,"status":"crash","duration_seconds":0,"description":"","patch_summary":"","worktree":"","error":""}
{"timestamp":"2026-03-30T14:42:00.484173619Z","iteration":3,"channel":2,"commit":"","metric_name":"post_quality","metric_value":0,"best_metric":8,"status":"crash","duration_seconds":0,"description":"","patch_summary":"","worktree":"","error":""}
{"timestamp":"2026-03-30T14:42:00.487051045Z","iteration":3,"channel":3,"commit":"","metric_name":"post_quality","metric_value":0,"best_metric":8,"status":"crash","duration_seconds":0,"description":"","patch_summary":"","worktree":"","error":""}
{"timestamp":"2026-03-30T14:42:00.489749703Z","iteration":3,"channel":0,"commit":"","metric_name":"post_quality","metric_value":0,"best_metric":8,"status":"crash","duration_seconds":0,"description":"","patch_summary":"","worktree":"","error":""}
{"timestamp":"2026-03-30T14:42:00.492432841Z","iteration":3,"channel":1,"commit":"","metric_name":"post_quality","metric_value":0,"best_metric":8,"status":"crash","duration_seconds":0,"description":"","patch_summary":"","worktree":"","error":""}
{"timestamp":"2026-03-30T14:42:00.495137079Z","iteration":3,"channel":4,"commit":"","metric_name":"post_quality","metric_value":0,"best_metric":8,"status":"crash","duration_seconds":0,"description":"","patch_summary":"","worktree":"","error":""}
{"timestamp":"2026-03-30T14:42:00.502965334Z","iteration":4,"channel":1,"commit":"","metric_name":"post_quality","metric_value":0,"best_metric":8,"status":"crash","duration_seconds":0,"description":"","patch_summary":"","worktree":"","error":""}
{"timestamp":"2026-03-30T14:42:00.506898812Z","iteration":4,"channel":0,"commit":"","metric_name":"post_quality","metric_value":0,"best_metric":8,"status":"crash","duration_seconds":0,"description":"","patch_summary":"","worktree":"","error":""}
{"timestamp":"2026-03-30T14:42:00.509648359Z","iteration":4,"channel":2,"commit":"","metric_name":"post_quality","metric_value":0,"best_metric":8,"status":"crash","duration_seconds":0,"description":"","patch_summary":"","worktree":"","error":""}
{"timestamp":"2026-03-30T14:42:00.512243668Z","iteration":4,"channel":4,"commit":"","metric_name":"post_quality","metric_value":0,"best_metric":8,"status":"crash","duration_seconds":0,"description":"","patch_summary":"","worktree":"","error":""}
{"timestamp":"2026-03-30T14:42:00.515051595Z","iteration":4,"channel":3,"commit":"","metric_name":"post_quality","metric_value":0,"best_metric":8,"status":"crash","duration_seconds":0,"description":"","patch_summary":"","worktree":"","error":""}
{"timestamp":"2026-03-30T14:42:00.523583154Z","iteration":5,"channel":2,"commit":"","metric_name":"post_quality","metric_value":0,"best_metric":8,"status":"crash","duration_seconds":0,"description":"","patch_summary":"","worktree":"","error":""}
{"timestamp":"2026-03-30T14:42:00.526253002Z","iteration":5,"channel":3,"commit":"","metric_name":"post_quality","metric_value":0,"best_metric":8,"status":"crash","duration_seconds":0,"description":"","patch_summary":"","worktree":"","error":""}
{"timestamp":"2026-03-30T14:42:00.52897328Z","iteration":5,"channel":1,"commit":"","metric_name":"post_quality","metric_value":0,"best_metric":8,"status":"crash","duration_seconds":0,"description":"","patch_summary":"","worktree":"","error":""}
{"timestamp":"2026-03-30T14:42:00.534771792Z","iteration":5,"channel":0,"commit":"","metric_name":"post_quality","metric_value":0,"best_metric":8,"status":"crash","duration_seconds":0,"description":"","patch_summary":"","worktree":"","error":""}
{"timestamp":"2026-03-30T14:42:00.541413437Z","iteration":5,"channel":4,"commit":"","metric_name":"post_quality","metric_value":0,"best_metric":8,"status":"crash","duration_seconds":0,"description":"","patch_summary":"","worktree":"","error":""}
{"timestamp":"2026-03-30T14:46:49.042628398Z","iteration":0,"channel":0,"commit":"2e039d6","metric_name":"post_quality","metric_value":8.5,"best_metric":8.5,"status":"keep","duration_seconds":152.260931779,"description":"baseline","patch_summary":"","worktree":"","error":""}
{"timestamp":"2026-03-30T14:48:36.987101942Z","iteration":1,"channel":0,"commit":"","metric_name":"post_quality","metric_value":0,"best_metric":8.5,"status":"crash","duration_seconds":0,"description":"LLM proposal failed","patch_summary":"","worktree":"/home/n0ko/Programs/ai/computeCommander/.autoresearch/worktrees/autoresearch/20260330-104416-exp-1-ch0","error":""}
{"timestamp":"2026-03-30T14:48:36.991416516Z","iteration":1,"channel":4,"commit":"","metric_name":"post_quality","metric_value":0,"best_metric":8.5,"status":"crash","duration_seconds":0,"description":"LLM proposal failed","patch_summary":"","worktree":"/home/n0ko/Programs/ai/computeCommander/.autoresearch/worktrees/autoresearch/20260330-104416-exp-1-ch4","error":""}
{"timestamp":"2026-03-30T14:48:36.994169493Z","iteration":1,"channel":1,"commit":"","metric_name":"post_quality","metric_value":0,"best_metric":8.5,"status":"crash","duration_seconds":0,"description":"LLM proposal failed","patch_summary":"","worktree":"/home/n0ko/Programs/ai/computeCommander/.autoresearch/worktrees/autoresearch/20260330-104416-exp-1-ch1","error":""}
{"timestamp":"2026-03-30T14:48:36.99694261Z","iteration":1,"channel":2,"commit":"","metric_name":"post_quality","metric_value":0,"best_metric":8.5,"status":"crash","duration_seconds":0,"description":"LLM proposal failed","patch_summary":"","worktree":"/home/n0ko/Programs/ai/computeCommander/.autoresearch/worktrees/autoresearch/20260330-104416-exp-1-ch2","error":""}
{"timestamp":"2026-03-30T14:48:36.999811347Z","iteration":1,"channel":3,"commit":"","metric_name":"post_quality","metric_value":0,"best_metric":8.5,"status":"crash","duration_seconds":0,"description":"LLM proposal failed","patch_summary":"","worktree":"/home/n0ko/Programs/ai/computeCommander/.autoresearch/worktrees/autoresearch/20260330-104416-exp-1-ch3","error":""}
{"timestamp":"2026-03-30T14:49:35.305621248Z","iteration":2,"channel":3,"commit":"","metric_name":"post_quality","metric_value":0,"best_metric":8.5,"status":"crash","duration_seconds":0,"description":"LLM proposal failed","patch_summary":"","worktree":"/home/n0ko/Programs/ai/computeCommander/.autoresearch/worktrees/autoresearch/20260330-104416-exp-2-ch3","error":""}
{"timestamp":"2026-03-30T14:49:35.31381389Z","iteration":2,"channel":1,"commit":"","metric_name":"post_quality","metric_value":0,"best_metric":8.5,"status":"crash","duration_seconds":0,"description":"LLM proposal failed","patch_summary":"","worktree":"/home/n0ko/Programs/ai/computeCommander/.autoresearch/worktrees/autoresearch/20260330-104416-exp-2-ch1","error":""}
{"timestamp":"2026-03-30T14:49:35.317891766Z","iteration":2,"channel":0,"commit":"","metric_name":"post_quality","metric_value":0,"best_metric":8.5,"status":"crash","duration_seconds":0,"description":"LLM proposal failed","patch_summary":"","worktree":"/home/n0ko/Programs/ai/computeCommander/.autoresearch/worktrees/autoresearch/20260330-104416-exp-2-ch0","error":""}
{"timestamp":"2026-03-30T14:49:35.320609944Z","iteration":2,"channel":4,"commit":"","metric_name":"post_quality","metric_value":0,"best_metric":8.5,"status":"crash","duration_seconds":0,"description":"LLM proposal failed","patch_summary":"","worktree":"/home/n0ko/Programs/ai/computeCommander/.autoresearch/worktrees/autoresearch/20260330-104416-exp-2-ch4","error":""}
{"timestamp":"2026-03-30T14:49:35.323192962Z","iteration":2,"channel":2,"commit":"","metric_name":"post_quality","metric_value":0,"best_metric":8.5,"status":"crash","duration_seconds":0,"description":"LLM proposal failed","patch_summary":"","worktree":"/home/n0ko/Programs/ai/computeCommander/.autoresearch/worktrees/autoresearch/20260330-104416-exp-2-ch2","error":""}
{"timestamp":"2026-03-30T14:50:35.883798074Z","iteration":3,"channel":4,"commit":"","metric_name":"post_quality","metric_value":0,"best_metric":8.5,"status":"crash","duration_seconds":0,"description":"LLM proposal failed","patch_summary":"","worktree":"/home/n0ko/Programs/ai/computeCommander/.autoresearch/worktrees/autoresearch/20260330-104416-exp-3-ch4","error":""}
{"timestamp":"2026-03-30T14:50:35.888200604Z","iteration":3,"channel":3,"commit":"","metric_name":"post_quality","metric_value":0,"best_metric":8.5,"status":"crash","duration_seconds":0,"description":"LLM proposal failed","patch_summary":"","worktree":"/home/n0ko/Programs/ai/computeCommander/.autoresearch/worktrees/autoresearch/20260330-104416-exp-3-ch3","error":""}
{"timestamp":"2026-03-30T14:50:35.891055231Z","iteration":3,"channel":1,"commit":"","metric_name":"post_quality","metric_value":0,"best_metric":8.5,"status":"crash","duration_seconds":0,"description":"LLM proposal failed","patch_summary":"","worktree":"/home/n0ko/Programs/ai/computeCommander/.autoresearch/worktrees/autoresearch/20260330-104416-exp-3-ch1","error":""}
{"timestamp":"2026-03-30T14:50:35.893607972Z","iteration":3,"channel":2,"commit":"","metric_name":"post_quality","metric_value":0,"best_metric":8.5,"status":"crash","duration_seconds":0,"description":"LLM proposal failed","patch_summary":"","worktree":"/home/n0ko/Programs/ai/computeCommander/.autoresearch/worktrees/autoresearch/20260330-104416-exp-3-ch2","error":""}
{"timestamp":"2026-03-30T14:50:35.896563658Z","iteration":3,"channel":0,"commit":"","metric_name":"post_quality","metric_value":0,"best_metric":8.5,"status":"crash","duration_seconds":0,"description":"LLM proposal failed","patch_summary":"","worktree":"/home/n0ko/Programs/ai/computeCommander/.autoresearch/worktrees/autoresearch/20260330-104416-exp-3-ch0","error":""}
{"timestamp":"2026-03-30T14:51:36.816298116Z","iteration":4,"channel":1,"commit":"","metric_name":"post_quality","metric_value":0,"best_metric":8.5,"status":"crash","duration_seconds":0,"description":"LLM proposal failed","patch_summary":"","worktree":"/home/n0ko/Programs/ai/computeCommander/.autoresearch/worktrees/autoresearch/20260330-104416-exp-4-ch1","error":""}
{"timestamp":"2026-03-30T14:51:36.824404706Z","iteration":4,"channel":0,"commit":"","metric_name":"post_quality","metric_value":0,"best_metric":8.5,"status":"crash","duration_seconds":0,"description":"LLM proposal failed","patch_summary":"","worktree":"/home/n0ko/Programs/ai/computeCommander/.autoresearch/worktrees/autoresearch/20260330-104416-exp-4-ch0","error":""}
{"timestamp":"2026-03-30T14:51:36.828935016Z","iteration":4,"channel":3,"commit":"","metric_name":"post_quality","metric_value":0,"best_metric":8.5,"status":"crash","duration_seconds":0,"description":"LLM proposal failed","patch_summary":"","worktree":"/home/n0ko/Programs/ai/computeCommander/.autoresearch/worktrees/autoresearch/20260330-104416-exp-4-ch3","error":""}
{"timestamp":"2026-03-30T14:51:36.835185036Z","iteration":4,"channel":4,"commit":"","metric_name":"post_quality","metric_value":0,"best_metric":8.5,"status":"crash","duration_seconds":0,"description":"LLM proposal failed","patch_summary":"","worktree":"/home/n0ko/Programs/ai/computeCommander/.autoresearch/worktrees/autoresearch/20260330-104416-exp-4-ch4","error":""}
{"timestamp":"2026-03-30T14:51:36.841386557Z","iteration":4,"channel":2,"commit":"","metric_name":"post_quality","metric_value":0,"best_metric":8.5,"status":"crash","duration_seconds":0,"description":"LLM proposal failed","patch_summary":"","worktree":"/home/n0ko/Programs/ai/computeCommander/.autoresearch/worktrees/autoresearch/20260330-104416-exp-4-ch2","error":""}
{"timestamp":"2026-03-30T14:52:26.280560665Z","iteration":5,"channel":4,"commit":"","metric_name":"post_quality","metric_value":0,"best_metric":8.5,"status":"crash","duration_seconds":0,"description":"LLM proposal failed","patch_summary":"","worktree":"/home/n0ko/Programs/ai/computeCommander/.autoresearch/worktrees/autoresearch/20260330-104416-exp-5-ch4","error":""}
{"timestamp":"2026-03-30T14:52:26.290406408Z","iteration":5,"channel":3,"commit":"","metric_name":"post_quality","metric_value":0,"best_metric":8.5,"status":"crash","duration_seconds":0,"description":"LLM proposal failed","patch_summary":"","worktree":"/home/n0ko/Programs/ai/computeCommander/.autoresearch/worktrees/autoresearch/20260330-104416-exp-5-ch3","error":""}
{"timestamp":"2026-03-30T14:52:26.296468601Z","iteration":5,"channel":2,"commit":"","metric_name":"post_quality","metric_value":0,"best_metric":8.5,"status":"crash","duration_seconds":0,"description":"LLM proposal failed","patch_summary":"","worktree":"/home/n0ko/Programs/ai/computeCommander/.autoresearch/worktrees/autoresearch/20260330-104416-exp-5-ch2","error":""}
{"timestamp":"2026-03-30T14:52:26.304408065Z","iteration":5,"channel":1,"commit":"","metric_name":"post_quality","metric_value":0,"best_metric":8.5,"status":"crash","duration_seconds":0,"description":"LLM proposal failed","patch_summary":"","worktree":"/home/n0ko/Programs/ai/computeCommander/.autoresearch/worktrees/autoresearch/20260330-104416-exp-5-ch1","error":""}
{"timestamp":"2026-03-30T14:52:26.31033567Z","iteration":5,"channel":0,"commit":"","metric_name":"post_quality","metric_value":0,"best_metric":8.5,"status":"crash","duration_seconds":0,"description":"LLM proposal failed","patch_summary":"","worktree":"/home/n0ko/Programs/ai/computeCommander/.autoresearch/worktrees/autoresearch/20260330-104416-exp-5-ch0","error":""}
{"timestamp":"2026-03-30T15:01:47.163938998Z","iteration":0,"channel":0,"commit":"2e039d6","metric_name":"post_quality","metric_value":8.45,"best_metric":8.45,"status":"keep","duration_seconds":310.262995784,"description":"baseline","patch_summary":"","worktree":"","error":""}
{"timestamp":"2026-03-30T15:01:49.261312049Z","iteration":1,"channel":0,"commit":"","metric_name":"post_quality","metric_value":0,"best_metric":8.45,"status":"crash","duration_seconds":0,"description":"LLM proposal failed","patch_summary":"","worktree":"/home/n0ko/Programs/ai/computeCommander/.autoresearch/worktrees/autoresearch/20260330-105636-exp-1-ch0","error":""}
{"timestamp":"2026-03-30T15:01:49.267082975Z","iteration":1,"channel":1,"commit":"","metric_name":"post_quality","metric_value":0,"best_metric":8.45,"status":"crash","duration_seconds":0,"description":"LLM proposal failed","patch_summary":"","worktree":"/home/n0ko/Programs/ai/computeCommander/.autoresearch/worktrees/autoresearch/20260330-105636-exp-1-ch1","error":""}
{"timestamp":"2026-03-30T15:01:51.378459471Z","iteration":2,"channel":0,"commit":"","metric_name":"post_quality","metric_value":0,"best_metric":8.45,"status":"crash","duration_seconds":0,"description":"LLM proposal failed","patch_summary":"","worktree":"/home/n0ko/Programs/ai/computeCommander/.autoresearch/worktrees/autoresearch/20260330-105636-exp-2-ch0","error":""}
{"timestamp":"2026-03-30T15:01:51.387261468Z","iteration":2,"channel":1,"commit":"","metric_name":"post_quality","metric_value":0,"best_metric":8.45,"status":"crash","duration_seconds":0,"description":"LLM proposal failed","patch_summary":"","worktree":"/home/n0ko/Programs/ai/computeCommander/.autoresearch/worktrees/autoresearch/20260330-105636-exp-2-ch1","error":""}
{"timestamp":"2026-03-30T15:01:53.472316408Z","iteration":3,"channel":1,"commit":"","metric_name":"post_quality","metric_value":0,"best_metric":8.45,"status":"crash","duration_seconds":0,"description":"LLM proposal failed","patch_summary":"","worktree":"/home/n0ko/Programs/ai/computeCommander/.autoresearch/worktrees/autoresearch/20260330-105636-exp-3-ch1","error":""}
{"timestamp":"2026-03-30T15:01:53.478029834Z","iteration":3,"channel":0,"commit":"","metric_name":"post_quality","metric_value":0,"best_metric":8.45,"status":"crash","duration_seconds":0,"description":"LLM proposal failed","patch_summary":"","worktree":"/home/n0ko/Programs/ai/computeCommander/.autoresearch/worktrees/autoresearch/20260330-105636-exp-3-ch0","error":""}
{"timestamp":"2026-03-30T15:13:39.446956982Z","iteration":0,"channel":0,"commit":"2e039d6","metric_name":"post_quality","metric_value":8.35,"best_metric":8.35,"status":"keep","duration_seconds":299.166974964,"description":"baseline","patch_summary":"","worktree":"","error":""}
{"timestamp":"2026-03-30T15:13:41.576451012Z","iteration":1,"channel":0,"commit":"","metric_name":"post_quality","metric_value":0,"best_metric":8.35,"status":"crash","duration_seconds":0,"description":"LLM proposal failed","patch_summary":"","worktree":"/home/n0ko/Programs/ai/computeCommander/.autoresearch/worktrees/autoresearch/20260330-110840-exp-1-ch0","error":""}
{"timestamp":"2026-03-30T15:13:41.586660192Z","iteration":1,"channel":1,"commit":"","metric_name":"post_quality","metric_value":0,"best_metric":8.35,"status":"crash","duration_seconds":0,"description":"LLM proposal failed","patch_summary":"","worktree":"/home/n0ko/Programs/ai/computeCommander/.autoresearch/worktrees/autoresearch/20260330-110840-exp-1-ch1","error":""}
{"timestamp":"2026-03-30T15:13:43.674035746Z","iteration":2,"channel":0,"commit":"","metric_name":"post_quality","metric_value":0,"best_metric":8.35,"status":"crash","duration_seconds":0,"description":"LLM proposal failed","patch_summary":"","worktree":"/home/n0ko/Programs/ai/computeCommander/.autoresearch/worktrees/autoresearch/20260330-110840-exp-2-ch0","error":""}
{"timestamp":"2026-03-30T15:13:43.68711435Z","iteration":2,"channel":1,"commit":"","metric_name":"post_quality","metric_value":0,"best_metric":8.35,"status":"crash","duration_seconds":0,"description":"LLM proposal failed","patch_summary":"","worktree":"/home/n0ko/Programs/ai/computeCommander/.autoresearch/worktrees/autoresearch/20260330-110840-exp-2-ch1","error":""}
