{"timestamp":"2026-03-30T15:13:45.857873259Z","iteration":3,"channel":1,"commit":"","metric_name":"post_quality","metric_value":0,"best_metric":8.35,"status":"crash","duration_seconds":0,"description":"LLM proposal failed","patch_summary":"","worktree":"/home/n0ko/Programs/ai/computeCommander/.autoresearch/worktrees/autoresearch/20260330-110840-exp-3-ch1","error":""}
{"timestamp":"2026-03-30T15:13:45.965898374Z","iteration":3,"channel":0,"commit":"","metric_name":"post_quality","metric_value":0,"best_metric":8.35,"status":"crash","duration_seconds":0,"description":"LLM proposal failed","patch_summary":"","worktree":"/home/n0ko/Programs/ai/computeCommander/.autoresearch/worktrees/autoresearch/20260330-110840-exp-3-ch0","error":""}
{"timestamp":"2026-03-30T15:19:51.294441792Z","iteration":0,"channel":0,"commit":"2e039d6","metric_name":"post_quality","metric_value":8.15,"best_metric":8.15,"status":"keep","duration_seconds":286.558158506,"description":"baseline","patch_summary":"","worktree":"","error":""}
{"timestamp":"2026-03-30T15:20:35.826553281Z","iteration":1,"channel":1,"commit":"","metric_name":"post_quality","metric_value":0,"best_metric":8.15,"status":"crash","duration_seconds":0,"description":"LLM proposal failed","patch_summary":"","worktree":"/home/n0ko/Programs/ai/computeCommander/.autoresearch/worktrees/autoresearch/20260330-111504-exp-1-ch1","error":""}
{"timestamp":"2026-03-30T15:20:35.831071171Z","iteration":1,"channel":0,"commit":"","metric_name":"post_quality","metric_value":0,"best_metric":8.15,"status":"crash","duration_seconds":0,"description":"LLM proposal failed","patch_summary":"","worktree":"/home/n0ko/Programs/ai/computeCommander/.autoresearch/worktrees/autoresearch/20260330-111504-exp-1-ch0","error":""}
{"timestamp":"2026-03-30T15:21:21.69827382Z","iteration":2,"channel":1,"commit":"","metric_name":"post_quality","metric_value":0,"best_metric":8.15,"status":"crash","duration_seconds":0,"description":"LLM proposal failed","patch_summary":"","worktree":"/home/n0ko/Programs/ai/computeCommander/.autoresearch/worktrees/autoresearch/20260330-111504-exp-2-ch1","error":""}
{"timestamp":"2026-03-30T15:21:21.701624141Z","iteration":2,"channel":0,"commit":"","metric_name":"post_quality","metric_value":0,"best_metric":8.15,"status":"crash","duration_seconds":0,"description":"LLM proposal failed","patch_summary":"","worktree":"/home/n0ko/Programs/ai/computeCommander/.autoresearch/worktrees/autoresearch/20260330-111504-exp-2-ch0","error":""}
{"timestamp":"2026-03-30T15:22:13.703783125Z","iteration":3,"channel":0,"commit":"","metric_name":"post_quality","metric_value":0,"best_metric":8.15,"status":"crash","duration_seconds":0,"description":"LLM proposal failed","patch_summary":"","worktree":"/home/n0ko/Programs/ai/computeCommander/.autoresearch/worktrees/autoresearch/20260330-111504-exp-3-ch0","error":""}
{"timestamp":"2026-03-30T15:22:13.707697791Z","iteration":3,"channel":1,"commit":"","metric_name":"post_quality","metric_value":0,"best_metric":8.15,"status":"crash","duration_seconds":0,"description":"LLM proposal failed","patch_summary":"","worktree":"/home/n0ko/Programs/ai/computeCommander/.autoresearch/worktrees/autoresearch/20260330-111504-exp-3-ch1","error":""}
